D:  Ver= 2.00 Cls=00(>ifc ) Sub=00 Prot=00 MxPS=64 #Cfgs=  1
P:  Vendor=c251 ProdID=1130 Rev= 1.00
S:  Manufacturer=Eurobraille sas
S:  Product=Esytime HID
S:  SerialNumber=0001A0000000
C:* #Ifs= 3 Cfg#= 1 Atr=80 MxPwr=100mA
I:* If#= 0 Alt= 0 #EPs= 1 Cls=03(HID  ) Sub=00 Prot=00 Driver=usbhid
E:  Ad=87(I) Atr=03(Int.) MxPS=  64 Ivl=32ms
I:* If#= 1 Alt= 0 #EPs= 1 Cls=03(HID  ) Sub=01 Prot=01 Driver=usbhid
E:  Ad=84(I) Atr=03(Int.) MxPS=   8 Ivl=32ms
I:* If#= 2 Alt= 0 #EPs= 2 Cls=03(HID  ) Sub=00 Prot=00 Driver=usbhid
E:  Ad=81(I) Atr=03(Int.) MxPS=  27 Ivl=32ms
E:  Ad=02(O) Atr=03(Int.) MxPS=  16 Ivl=32ms
