D:  Ver= 2.00 Cls=ef(misc ) Sub=02 Prot=01 MxPS= 8 #Cfgs=  1
P:  Vendor=28ac ProdID=0012 Rev= 2.00
S:  Manufacturer=Eurobraille
S:  Product=erb composite keyboard + comPort
S:  SerialNumber=78AA98343132
C:* #Ifs= 5 Cfg#= 1 Atr=c0 MxPwr=100mA
A:  FirstIf#= 0 IfCount= 2 Cls=02(comm.) Sub=02 Prot=01
A:  FirstIf#= 2 IfCount= 2 Cls=02(comm.) Sub=02 Prot=01
I:* If#= 0 Alt= 0 #EPs= 1 Cls=02(comm.) Sub=02 Prot=01 Driver=cdc_acm
E:  Ad=82(I) Atr=03(Int.) MxPS=   8 Ivl=16ms
I:* If#= 1 Alt= 0 #EPs= 2 Cls=0a(data ) Sub=00 Prot=00 Driver=cdc_acm
E:  Ad=01(O) Atr=02(Bulk) MxPS=  64 Ivl=0ms
E:  Ad=81(I) Atr=02(Bulk) MxPS=  64 Ivl=0ms
I:* If#= 2 Alt= 0 #EPs= 1 Cls=02(comm.) Sub=02 Prot=01 Driver=cdc_acm
E:  Ad=86(I) Atr=03(Int.) MxPS=   8 Ivl=16ms
I:* If#= 3 Alt= 0 #EPs= 2 Cls=0a(data ) Sub=00 Prot=00 Driver=cdc_acm
E:  Ad=05(O) Atr=02(Bulk) MxPS=  64 Ivl=0ms
E:  Ad=85(I) Atr=02(Bulk) MxPS=  64 Ivl=0ms
I:* If#= 4 Alt= 0 #EPs= 2 Cls=03(HID  ) Sub=01 Prot=01 Driver=usbhid
E:  Ad=87(I) Atr=03(Int.) MxPS=   8 Ivl=5ms
E:  Ad=07(O) Atr=03(Int.) MxPS=   2 Ivl=5ms
