D:  Ver= 2.00 Cls=02(comm.) Sub=00 Prot=00 MxPS=64 #Cfgs=  3
P:  Vendor=1c71 ProdID=c005 Rev= 0.02
S:  Manufacturer=FREESCALE SEMI
S:  Product= BRAILLE DEVICE
S:  SerialNumber= 000333
C:* #Ifs= 2 Cfg#= 1 Atr=80 MxPwr=500mA
I:* If#= 0 Alt= 0 #EPs= 1 Cls=02(comm.) Sub=02 Prot=00 Driver=usbfs
E:  Ad=81(I) Atr=03(Int.) MxPS=  16 Ivl=10ms
I:* If#= 1 Alt= 0 #EPs= 2 Cls=0a(data ) Sub=00 Prot=00 Driver=usbfs
E:  Ad=82(I) Atr=02(Bulk) MxPS=  64 Ivl=0ms
E:  Ad=03(O) Atr=02(Bulk) MxPS=  64 Ivl=0ms
C:  #Ifs= 2 Cfg#= 1 Atr=80 MxPwr=500mA
I:  If#= 0 Alt= 0 #EPs= 1 Cls=02(comm.) Sub=02 Prot=00 Driver=
E:  Ad=81(I) Atr=03(Int.) MxPS=  16 Ivl=10ms
I:  If#= 1 Alt= 0 #EPs= 2 Cls=0a(data ) Sub=00 Prot=00 Driver=
E:  Ad=82(I) Atr=02(Bulk) MxPS=  64 Ivl=0ms
E:  Ad=03(O) Atr=02(Bulk) MxPS=  64 Ivl=0ms
C:  #Ifs= 2 Cfg#= 1 Atr=80 MxPwr=500mA
I:  If#= 0 Alt= 0 #EPs= 1 Cls=02(comm.) Sub=02 Prot=00 Driver=
E:  Ad=81(I) Atr=03(Int.) MxPS=  16 Ivl=10ms
I:  If#= 1 Alt= 0 #EPs= 2 Cls=0a(data ) Sub=00 Prot=00 Driver=
E:  Ad=82(I) Atr=02(Bulk) MxPS=  64 Ivl=0ms
E:  Ad=03(O) Atr=02(Bulk) MxPS=  64 Ivl=0ms
