D:  Ver= 2.00 Cls=00(>ifc ) Sub=00 Prot=00 MxPS=64 #Cfgs=  3
P:  Vendor=1c71 ProdID=c006 Rev= 0.02
S:  Manufacturer=FREESCALE SEMICONDUCTOR INC.
S:  Product= BRAILLE DEVICE
S:  SerialNumber= 000333
C:* #Ifs= 1 Cfg#= 1 Atr=80 MxPwr=500mA
I:* If#= 0 Alt= 0 #EPs= 1 Cls=03(HID  ) Sub=00 Prot=00 Driver=usbfs
E:  Ad=81(I) Atr=03(Int.) MxPS=   9 Ivl=10ms
C:  #Ifs= 1 Cfg#= 1 Atr=80 MxPwr=500mA
I:  If#= 0 Alt= 0 #EPs= 1 Cls=03(HID  ) Sub=00 Prot=00 Driver=
E:  Ad=81(I) Atr=03(Int.) MxPS=   9 Ivl=10ms
C:  #Ifs= 1 Cfg#= 1 Atr=80 MxPwr=500mA
I:  If#= 0 Alt= 0 #EPs= 1 Cls=03(HID  ) Sub=00 Prot=00 Driver=
E:  Ad=81(I) Atr=03(Int.) MxPS=   9 Ivl=10ms
