D:  Ver= 2.00 Cls=ef(misc ) Sub=02 Prot=01 MxPS=64 #Cfgs=  1
P:  Vendor=0904 ProdID=6102 Rev= 0.00
S:  Manufacturer=BAUM Systeme GmbH
S:  Product=VarioUltra40
S:  SerialNumber=a7af605f-7740-4dae-b329-202daf5ab80d
C:* #Ifs= 2 Cfg#= 1 Atr=80 MxPwr=500mA
I:* If#= 0 Alt= 0 #EPs= 2 Cls=03(HID  ) Sub=00 Prot=00 Driver=(none)
E:  Ad=81(I) Atr=03(Int.) MxPS=  64 Ivl=64ms
E:  Ad=02(O) Atr=03(Int.) MxPS=  64 Ivl=64ms
I:* If#= 1 Alt= 0 #EPs= 3 Cls=06(still) Sub=01 Prot=01 Driver=(none)
E:  Ad=83(I) Atr=02(Bulk) MxPS= 512 Ivl=0ms
E:  Ad=04(O) Atr=02(Bulk) MxPS= 512 Ivl=0ms
E:  Ad=85(I) Atr=03(Int.) MxPS= 512 Ivl=1ms
