D:  Ver= 1.00 Cls=ff(vend.) Sub=ff Prot=ff MxPS=64 #Cfgs=  1
P:  Vendor=0904 ProdID=1016 Rev= 0.00
C:* #Ifs= 1 Cfg#= 1 Atr=80 MxPwr=100mA
I:* If#= 0 Alt= 0 #EPs= 0 Cls=ff(vend.) Sub=ff Prot=ff Driver=(none)
I:  If#= 0 Alt= 1 #EPs=13 Cls=ff(vend.) Sub=ff Prot=ff Driver=(none)
E:  Ad=81(I) Atr=03(Int.) MxPS=  16 Ivl=10ms
E:  Ad=82(I) Atr=02(Bulk) MxPS=  64 Ivl=0ms
E:  Ad=02(O) Atr=02(Bulk) MxPS=  64 Ivl=0ms
E:  Ad=84(I) Atr=02(Bulk) MxPS=  64 Ivl=0ms
E:  Ad=04(O) Atr=02(Bulk) MxPS=  64 Ivl=0ms
E:  Ad=86(I) Atr=02(Bulk) MxPS=  64 Ivl=0ms
E:  Ad=06(O) Atr=02(Bulk) MxPS=  64 Ivl=0ms
E:  Ad=88(I) Atr=01(Isoc) MxPS=  16 Ivl=1ms
E:  Ad=08(O) Atr=01(Isoc) MxPS=  16 Ivl=1ms
E:  Ad=89(I) Atr=01(Isoc) MxPS=  16 Ivl=1ms
E:  Ad=09(O) Atr=01(Isoc) MxPS=  16 Ivl=1ms
E:  Ad=8a(I) Atr=01(Isoc) MxPS=  16 Ivl=1ms
E:  Ad=0a(O) Atr=01(Isoc) MxPS=  16 Ivl=1ms
I:  If#= 0 Alt= 2 #EPs=13 Cls=ff(vend.) Sub=ff Prot=ff Driver=(none)
E:  Ad=81(I) Atr=03(Int.) MxPS=  64 Ivl=10ms
E:  Ad=82(I) Atr=02(Bulk) MxPS=  64 Ivl=0ms
E:  Ad=02(O) Atr=02(Bulk) MxPS=  64 Ivl=0ms
E:  Ad=84(I) Atr=02(Bulk) MxPS=  64 Ivl=0ms
E:  Ad=04(O) Atr=02(Bulk) MxPS=  64 Ivl=0ms
E:  Ad=86(I) Atr=02(Bulk) MxPS=  64 Ivl=0ms
E:  Ad=06(O) Atr=02(Bulk) MxPS=  64 Ivl=0ms
E:  Ad=88(I) Atr=01(Isoc) MxPS= 256 Ivl=1ms
E:  Ad=08(O) Atr=01(Isoc) MxPS= 256 Ivl=1ms
E:  Ad=89(I) Atr=01(Isoc) MxPS=  16 Ivl=1ms
E:  Ad=09(O) Atr=01(Isoc) MxPS=  16 Ivl=1ms
E:  Ad=8a(I) Atr=01(Isoc) MxPS=  16 Ivl=1ms
E:  Ad=0a(O) Atr=01(Isoc) MxPS=  16 Ivl=1ms
