D:  Ver= 2.00 Cls=00(>ifc ) Sub=00 Prot=00 MxPS=64 #Cfgs=  1
P:  Vendor=239a ProdID=802c Rev= 1.00
S:  Manufacturer=Zoomax
S:  Product=LoC BeR M4 base board
S:  SerialNumber=FB5CD5873475433502020274E29120FF
C:* #Ifs= 6 Cfg#= 1 Atr=a0 MxPwr=100mA
A:  FirstIf#= 0 IfCount= 2 Cls=02(comm.) Sub=02 Prot=00
I:* If#= 0 Alt= 0 #EPs= 1 Cls=02(comm.) Sub=02 Prot=00 Driver=cdc_acm
E:  Ad=81(I) Atr=03(Int.) MxPS=  64 Ivl=16ms
I:* If#= 1 Alt= 0 #EPs= 2 Cls=0a(data ) Sub=00 Prot=00 Driver=cdc_acm
E:  Ad=02(O) Atr=02(Bulk) MxPS=  64 Ivl=0ms
E:  Ad=82(I) Atr=02(Bulk) MxPS=  64 Ivl=0ms
I:* If#= 2 Alt= 0 #EPs= 2 Cls=08(stor.) Sub=06 Prot=50 Driver=usb-storage
E:  Ad=83(I) Atr=02(Bulk) MxPS=  64 Ivl=0ms
E:  Ad=03(O) Atr=02(Bulk) MxPS=  64 Ivl=0ms
I:* If#= 3 Alt= 0 #EPs= 2 Cls=03(HID  ) Sub=00 Prot=00 Driver=usbhid
E:  Ad=84(I) Atr=03(Int.) MxPS=  64 Ivl=8ms
E:  Ad=04(O) Atr=03(Int.) MxPS=  64 Ivl=8ms
I:* If#= 4 Alt= 0 #EPs= 0 Cls=01(audio) Sub=01 Prot=00 Driver=snd-usb-audio
I:* If#= 5 Alt= 0 #EPs= 2 Cls=01(audio) Sub=03 Prot=00 Driver=snd-usb-audio
E:  Ad=06(O) Atr=02(Bulk) MxPS=  64 Ivl=0ms
E:  Ad=86(I) Atr=02(Bulk) MxPS=  64 Ivl=0ms
